{
  "schema_version": 1,
  "id": "technical-program-manager",
  "name": "Technical Program Manager",
  "title_aliases": [
    "technical program manager",
    "tpm"
  ],
  "dimensions": [
    {
      "id": "delivery",
      "weight": 0.14285714285714285,
      "terms": [
        "program delivery",
        "delivery"
      ],
      "required_level": 3
    },
    {
      "id": "stakeholders",
      "weight": 0.14285714285714285,
      "terms": [
        "stakeholder management",
        "stakeholder"
      ],
      "required_level": 3
    },
    {
      "id": "strategy",
      "weight": 0.14285714285714285,
      "terms": [
        "roadmap strategy",
        "roadmap"
      ],
      "required_level": 3
    },
    {
      "id": "dependencies",
      "weight": 0.14285714285714285,
      "terms": [
        "dependencies"
      ],
      "required_level": 3
    },
    {
      "id": "risk",
      "weight": 0.14285714285714285,
      "terms": [
        "risk management",
        "risk"
      ],
      "required_level": 3
    },
    {
      "id": "depth",
      "weight": 0.14285714285714285,
      "terms": [
        "technical depth",
        "architecture"
      ],
      "required_level": 3
    },
    {
      "id": "communication",
      "weight": 0.14285714285714285,
      "terms": [
        "executive communication",
        "communication"
      ],
      "required_level": 3
    }
  ]
}
