{
  "schema_version": 1,
  "id": "product-manager",
  "name": "Product Manager",
  "title_aliases": [
    "product manager"
  ],
  "dimensions": [
    {
      "id": "strategy",
      "weight": 0.2,
      "terms": [
        "product strategy",
        "roadmap"
      ],
      "required_level": 3
    },
    {
      "id": "discovery",
      "weight": 0.2,
      "terms": [
        "discovery",
        "customer research"
      ],
      "required_level": 3
    },
    {
      "id": "prioritization",
      "weight": 0.2,
      "terms": [
        "prioritization"
      ],
      "required_level": 3
    },
    {
      "id": "analytics",
      "weight": 0.2,
      "terms": [
        "metrics",
        "experimentation"
      ],
      "required_level": 3
    },
    {
      "id": "delivery",
      "weight": 0.2,
      "terms": [
        "delivery",
        "stakeholder"
      ],
      "required_level": 3
    }
  ]
}
